{"approvals":[{"approved_at":"2026-09-18T11:53:44.8525167-03:00","approved_by":"Mário Tinelli","publication_sha256":"b58729ed8fc842025413394efc61cf97ea58c49f5257c5e95489c90f6c960f9f","revision":1,"status":"valid"}],"completed_at":"2026-09-18T14:58:42.404Z","operations":{"create:dev-1":{"attempts":[{"attempted_at":"2026-09-18T11:53:52.1601698-03:00","id":1,"observations_before":0,"outcome":"completed","payload_sha256":"a7694d03b2ec790ce8a55825027c7846c0e5338ecef0fa628e90b7cb5345de82","response_recorded_at":"2026-09-18T11:54:17.3720052-03:00"}],"kind":"create","observations":[],"remote_id":1014752,"status":"completed"},"create:dev-2":{"attempts":[{"attempted_at":"2026-09-18T11:54:22.1586488-03:00","id":1,"observations_before":0,"outcome":"completed","payload_sha256":"234a37eb204c8f2d56679be07cb5e05327e17136867c1aaa2bc7cf9d854489f2","response_recorded_at":"2026-09-18T11:54:44.1918679-03:00"}],"kind":"create","observations":[],"remote_id":1014753,"status":"completed"},"create:qa":{"attempts":[{"attempted_at":"2026-09-18T11:54:52.1972299-03:00","id":1,"observations_before":0,"outcome":"completed","payload_sha256":"bb7c711db64c4aa9cfdf98bdaf9b9b9395d1fb1a15870513559d27fe7fd5b7e8","response_recorded_at":"2026-09-18T11:55:21.5516928-03:00"}],"kind":"create","observations":[],"remote_id":1014754,"status":"completed"},"relation:blocks:dev-1:qa":{"attempts":[{"attempted_at":"2026-09-18T11:55:30.0963167-03:00","id":1,"observations_before":0,"outcome":"completed","payload_sha256":"98c03f6854196d2b477708e653a03d43ca76fc622bf11c0ef9da127e40a24390","response_recorded_at":"2026-09-18T11:55:47.3090888-03:00"}],"kind":"relation","observations":[],"remote_id":694,"status":"completed"},"relation:blocks:dev-2:qa":{"attempts":[{"attempted_at":"2026-09-18T11:55:47.4285258-03:00","id":1,"observations_before":0,"outcome":"completed","payload_sha256":"d67cc8a0fc16c2a69586c842a7bc6b68179b06c738493e6d0adb4e0030d1aedc","response_recorded_at":"2026-09-18T11:55:58.4443795-03:00"}],"kind":"relation","observations":[],"remote_id":695,"status":"completed"}},"readback":{"observed_at":"2026-09-18T14:58:42.404Z","path":"C:\\Users\\maari\\Herd\\github\\nexum\\docs\\harness\\features\\1014446-autenticacao\\.work\\slices-publication-readback.json","sha256":"07a76c78b11b8fc7ea6c095569770f6c73498c40ae2575f29ae22680d98dff53"},"revisions":[{"children":[{"attributes":{"assigned_to_id":null,"description":"## Entrega\n\nPermitir que pessoas de todos os perfis com conta ativa entrem no Nexum e naveguem pelas capacidades disponíveis e permitidas, em desktop e mobile.\n\n## Escopo e limites\n\nInclui login, painel existente como destino, bloqueio de contas inativas e de sessões após desativação, indisponibilidade do cadastro público e experiência acessível de login/navegação, incluindo os controles Lembrar-me e Sair. Não implementa a administração de contas, recuperação de senha, perfil, projetos ou indicadores. O comportamento temporal da lembrança e o isolamento da saída pertencem à entrega 2.\n\n## Critérios de aceite\n\n- Conta ativa, de qualquer perfil, com e-mail e senha válidos acessa o painel existente. O login não altera seu perfil nem suas permissões.\n- Campos obrigatórios ausentes ou e-mail inválido exibem validação, permitem correção e não autenticam. Credenciais inválidas recusam a entrada; conta inativa é recusada com orientação para solicitar reativação.\n- Ao desativar uma conta com sessões abertas em dois dispositivos, a próxima ação autenticada em cada um é bloqueada, inclusive em interações da tela sem navegação completa. A desativação também impede novo login.\n- Cadastro público não é disponibilizado nem permite criar contas por acesso direto às rotas públicas existentes. Criação administrativa permanece sob responsabilidade de Gestão de Usuário.\n- Navegação exibe somente capacidades entregues e permitidas; autenticar não concede participação em projetos nem acesso administrativo adicional. Restrições são aplicadas no servidor também por acesso direto.\n- A entrada para recuperação de acesso fica disponível conforme a capacidade for entregue, sem implementar neste corte o fluxo de recuperação.\n- Login e navegação funcionam em desktop e mobile, em português, com campos e controles utilizáveis, labels associados, nomes acessíveis, ordem de teclado e foco visível. Inclui Lembrar-me, revelar senha, menus e Sair.\n- A interface atende contraste WCAG AA, hierarquia semântica, alvos de toque adequados e preferência por redução de movimento. Durante o envio apresenta carregamento; erros descritivos e resultado de sucesso são perceptíveis por tecnologias assistivas.\n- Senhas permanecem protegidas e não são expostas em mensagens; erros não revelam dados sensíveis. A entrada e a navegação preservam a autorização no servidor.\n\n## Dependências\n\nNenhum bloqueio para iniciar: a base de login, contas, autorização e painel já existe. As capacidades das outras Features são disponibilizadas quando entregues, sem antecipar sua implementação.\n\n## Referências\n\nItem pai Redmine #1014446; regras/critérios R1, R2, R3, R6, R7, CA1, CA2, CA3, CA4, CA8, CA9, CA10, ESCOPO-A11Y, ESCOPO-SEG, FLUXO-REC.\n\n<!-- project-slices-child:2fcfcd2d0cb3fb290d9709c80750966b29a38cc838734f3cf86738f555f2d534 -->\n","due_date":null,"estimated_hours":2.5,"parent_issue_id":1014446,"priority_id":4,"project_id":65221,"start_date":null,"status_id":1,"subject":"[DEV] [WEB] [PUBLICO] Autenticação - Entrada e navegação de contas ativas","tracker_id":4},"description":"## Entrega\n\nPermitir que pessoas de todos os perfis com conta ativa entrem no Nexum e naveguem pelas capacidades disponíveis e permitidas, em desktop e mobile.\n\n## Escopo e limites\n\nInclui login, painel existente como destino, bloqueio de contas inativas e de sessões após desativação, indisponibilidade do cadastro público e experiência acessível de login/navegação, incluindo os controles Lembrar-me e Sair. Não implementa a administração de contas, recuperação de senha, perfil, projetos ou indicadores. O comportamento temporal da lembrança e o isolamento da saída pertencem à entrega 2.\n\n## Critérios de aceite\n\n- Conta ativa, de qualquer perfil, com e-mail e senha válidos acessa o painel existente. O login não altera seu perfil nem suas permissões.\n- Campos obrigatórios ausentes ou e-mail inválido exibem validação, permitem correção e não autenticam. Credenciais inválidas recusam a entrada; conta inativa é recusada com orientação para solicitar reativação.\n- Ao desativar uma conta com sessões abertas em dois dispositivos, a próxima ação autenticada em cada um é bloqueada, inclusive em interações da tela sem navegação completa. A desativação também impede novo login.\n- Cadastro público não é disponibilizado nem permite criar contas por acesso direto às rotas públicas existentes. Criação administrativa permanece sob responsabilidade de Gestão de Usuário.\n- Navegação exibe somente capacidades entregues e permitidas; autenticar não concede participação em projetos nem acesso administrativo adicional. Restrições são aplicadas no servidor também por acesso direto.\n- A entrada para recuperação de acesso fica disponível conforme a capacidade for entregue, sem implementar neste corte o fluxo de recuperação.\n- Login e navegação funcionam em desktop e mobile, em português, com campos e controles utilizáveis, labels associados, nomes acessíveis, ordem de teclado e foco visível. Inclui Lembrar-me, revelar senha, menus e Sair.\n- A interface atende contraste WCAG AA, hierarquia semântica, alvos de toque adequados e preferência por redução de movimento. Durante o envio apresenta carregamento; erros descritivos e resultado de sucesso são perceptíveis por tecnologias assistivas.\n- Senhas permanecem protegidas e não são expostas em mensagens; erros não revelam dados sensíveis. A entrada e a navegação preservam a autorização no servidor.\n\n## Dependências\n\nNenhum bloqueio para iniciar: a base de login, contas, autorização e painel já existe. As capacidades das outras Features são disponibilizadas quando entregues, sem antecipar sua implementação.\n\n## Referências\n\nItem pai Redmine #1014446; regras/critérios R1, R2, R3, R6, R7, CA1, CA2, CA3, CA4, CA8, CA9, CA10, ESCOPO-A11Y, ESCOPO-SEG, FLUXO-REC.\n\n<!-- project-slices-child:2fcfcd2d0cb3fb290d9709c80750966b29a38cc838734f3cf86738f555f2d534 -->\n","description_path":"C:\\Users\\maari\\Herd\\github\\nexum\\docs\\harness\\features\\1014446-autenticacao\\slices\\descriptions\\dev-1.md","estimate_hours":2.5,"identity":"2fcfcd2d0cb3fb290d9709c80750966b29a38cc838734f3cf86738f555f2d534","key":"dev-1","kind":"dev","payload_sha256":"a7694d03b2ec790ce8a55825027c7846c0e5338ecef0fa628e90b7cb5345de82","title":"[DEV] [WEB] [PUBLICO] Autenticação - Entrada e navegação de contas ativas"},{"attributes":{"assigned_to_id":null,"description":"## Entrega\n\nManter a lembrança de acesso por 30 dias a partir do login e permitir sair apenas do navegador atual.\n\n## Escopo e limites\n\nInclui prazo fixo da lembrança, retorno após fechar o navegador e saída com remoção de sessão e lembrança locais. Não redefine a validade da sessão ordinária nem implementa recuperação de senha ou administração de contas. Usa o bloqueio de contas desativadas da entrega 1; a experiência acessível dos controles é coberta por ela.\n\n## Critérios de aceite\n\n- Com conta ativa e Lembrar-me marcado, fechar e reabrir o navegador dentro dos 30 dias do login permite restaurar o acesso.\n- Encerrados os 30 dias, a lembrança não autentica. Sem sessão válida, o usuário precisa entrar novamente; acessos intermediários não renovam automaticamente o prazo contado desde o login.\n- Com acesso válido em dois navegadores, Sair encerra a sessão e remove a lembrança somente no navegador usado. Retornar nele exige login quando não houver nova sessão válida.\n- A saída em um navegador preserva o acesso e a lembrança ainda válidos no outro, inclusive ao fechá-lo e reabri-lo dentro do prazo.\n- A lembrança não permite contornar d